mysql> Select * From Library//
+--------+------------------------+---------------------+---------------------------+-----------------------+
| BookId | BookName               | Author              | Publisher                 | Genre                 |
+--------+------------------------+---------------------+---------------------------+-----------------------+
|      1 | The Great Gatsby       | F. Scott Fitzgerald | Scribner                  | Fiction               |
|      2 | To Kill a Mockingbird  | Harper Lee          | J.B. Lippincott & Co.     | Fiction               |
|      3 | 1984                   | George Orwell       | Secker & Warburg          | Dystopian             |
|      4 | Pride and Prejudice    | Jane Austen         | T. Egerton                | Romance               |
|      5 | The Catcher in the Rye | J.D. Salinger       | Little, Brown and Company | Fiction               |
|      6 | The Hobbit             | J.R.R. Tolkien      | George Allen & Unwin      | Fantasy               |
|      7 | War and Peace          | Leo Tolstoy         | The Russian Messenger     | Historical Fiction    |
|      8 | The Lord of the Rings  | J.R.R. Tolkien      | George Allen & Unwin      | Fantasy               |
|      9 | Crime and Punishment   | Fyodor Dostoevsky   | The Russian Messenger     | Psychological Fiction |
+--------+------------------------+---------------------+---------------------------+-----------------------+
9 rows in set (0.00 sec)

mysql> Update Library
    -> Set BookName = "Animal Farm"
    -> Where BookId = 3
    -> //
Query OK, 1 row affected (0.04 sec)
Rows matched: 1  Changed: 1  Warnings: 0

mysql> Delete From Library
    -> Where BookId = 9
    -> //
Query OK, 1 row affected (0.03 sec)

mysql> Select * From Library_Audit//
+--------+----------------------+-------------------+-----------------------+-----------------------+------+---------------------+
| BookId | BookName             | Author            | Publisher             | Genre                 | Type | Time                |
+--------+----------------------+-------------------+-----------------------+-----------------------+------+---------------------+
|      3 | 1984                 | George Orwell     | Secker & Warburg      | Dystopian             | U    | 2025-08-14 12:23:30 |
|      9 | Crime and Punishment | Fyodor Dostoevsky | The Russian Messenger | Psychological Fiction | D    | 2025-08-14 12:23:34 |
+--------+----------------------+-------------------+-----------------------+-----------------------+------+---------------------+
2 rows in set (0.00 sec)

mysql> Select * From Library//
+--------+------------------------+---------------------+---------------------------+--------------------+
| BookId | BookName               | Author              | Publisher                 | Genre              |
+--------+------------------------+---------------------+---------------------------+--------------------+
|      1 | The Great Gatsby       | F. Scott Fitzgerald | Scribner                  | Fiction            |
|      2 | To Kill a Mockingbird  | Harper Lee          | J.B. Lippincott & Co.     | Fiction            |
|      3 | Animal Farm            | George Orwell       | Secker & Warburg          | Dystopian          |
|      4 | Pride and Prejudice    | Jane Austen         | T. Egerton                | Romance            |
|      5 | The Catcher in the Rye | J.D. Salinger       | Little, Brown and Company | Fiction            |
|      6 | The Hobbit             | J.R.R. Tolkien      | George Allen & Unwin      | Fantasy            |
|      7 | War and Peace          | Leo Tolstoy         | The Russian Messenger     | Historical Fiction |
|      8 | The Lord of the Rings  | J.R.R. Tolkien      | George Allen & Unwin      | Fantasy            |
+--------+------------------------+---------------------+---------------------------+--------------------+
8 rows in set (0.00 sec)

mysql> notee
mysql> Update Library
    -> Set BookId = 20
    -> Where BookId = 8;
Query OK, 1 row affected (0.05 sec)
Rows matched: 1  Changed: 1  Warnings: 0

mysql> Select * From Library_Audit;
+--------+-----------------------+-------------------+-----------------------+-----------------------+------+---------------------+
| BookId | BookName              | Author            | Publisher             | Genre                 | Type | Time                |
+--------+-----------------------+-------------------+-----------------------+-----------------------+------+---------------------+
|      3 | 1984                  | George Orwell     | Secker & Warburg      | Dystopian             | U    | 2025-08-14 12:23:30 |
|      8 | The Lord of the Rings | J.R.R. Tolkien    | George Allen & Unwin  | Fantasy               | U    | 2025-08-28 11:23:04 |
|      9 | Crime and Punishment  | Fyodor Dostoevsky | The Russian Messenger | Psychological Fiction | D    | 2025-08-14 12:23:34 |
+--------+-----------------------+-------------------+-----------------------+-----------------------+------+---------------------+
3 rows in set (0.00 sec)

mysql> Delete From Library
    -> Where BookId>=7;
Query OK, 2 rows affected (0.03 sec)

mysql> Select * From Library;
+--------+------------------------+---------------------+---------------------------+-----------+
| BookId | BookName               | Author              | Publisher                 | Genre     |
+--------+------------------------+---------------------+---------------------------+-----------+
|      1 | The Great Gatsby       | F. Scott Fitzgerald | Scribner                  | Fiction   |
|      2 | To Kill a Mockingbird  | Harper Lee          | J.B. Lippincott & Co.     | Fiction   |
|      3 | Animal Farm            | George Orwell       | Secker & Warburg          | Dystopian |
|      4 | Pride and Prejudice    | Jane Austen         | T. Egerton                | Romance   |
|      5 | The Catcher in the Rye | J.D. Salinger       | Little, Brown and Company | Fiction   |
|      6 | The Hobbit             | J.R.R. Tolkien      | George Allen & Unwin      | Fantasy   |
+--------+------------------------+---------------------+---------------------------+-----------+
6 rows in set (0.00 sec)

mysql> Select * From Library_Audit;
+--------+-----------------------+-------------------+-----------------------+-----------------------+------+---------------------+
| BookId | BookName              | Author            | Publisher             | Genre                 | Type | Time                |
+--------+-----------------------+-------------------+-----------------------+-----------------------+------+---------------------+
|      3 | 1984                  | George Orwell     | Secker & Warburg      | Dystopian             | U    | 2025-08-14 12:23:30 |
|      7 | War and Peace         | Leo Tolstoy       | The Russian Messenger | Historical Fiction    | D    | 2025-08-28 11:23:48 |
|      8 | The Lord of the Rings | J.R.R. Tolkien    | George Allen & Unwin  | Fantasy               | U    | 2025-08-28 11:23:04 |
|      9 | Crime and Punishment  | Fyodor Dostoevsky | The Russian Messenger | Psychological Fiction | D    | 2025-08-14 12:23:34 |
|     20 | The Lord of the Rings | J.R.R. Tolkien    | George Allen & Unwin  | Fantasy               | D    | 2025-08-28 11:23:48 |
+--------+-----------------------+-------------------+-----------------------+-----------------------+------+---------------------+
5 rows in set (0.00 sec)
